<?xml version="1.0" encoding="UTF-8"?>
<xs:schema xmlns:xs="http://www.w3.org/2001/XMLSchema" elementFormDefault="qualified" attributeFormDefault="qualified">

    <!-- Elemek, tulajdonságok -->

    <xs:element name="telepules" type="xs:string" />
    <xs:element name="fizetes" type="xs:integer" />
    <xs:element name="ledolgozott_evek" type="xs:integer" />
    <xs:element name="sebesseghatar" type="xs:integer" />
    <xs:element name="osszeg" type="xs:integer" />
    <xs:element name="rendszam" type="xs:string" />
    <xs:element name="varos" type="xs:string" />
    <xs:element name="lakcim" type="xs:string" />

    <xs:attribute name="AF_ID" type="xs:integer" />
    <xs:attribute name="AF_IDREF" type="xs:integer" />
    <xs:attribute name="AL_ID" type="xs:integer" />
    <xs:attribute name="AL_IDREF" type="xs:integer" />
    <xs:attribute name="AU_ID" type="xs:integer" />
    <xs:attribute name="AU_IDREF" type="xs:integer" />
    <xs:attribute name="T_ID" type="xs:integer" />
    <xs:attribute name="B_ID" type="xs:integer" />
    <xs:attribute name="B_IDREF" type="xs:integer" />
    <xs:attribute name="SZ_ID" type="xs:integer" />

    <!-- Egyszerű típusok -->

    <xs:simpleType name="datum_type">
        <xs:restriction base="xs:string">
            <xs:pattern value="(19|20)\d\d.(0[1-9]|1[012]).(0[1-9]|[12][0-9]|3[01])"></xs:pattern>
        </xs:restriction>
    </xs:simpleType>

    <xs:simpleType name="iranyitoszam_type">
        <xs:restriction base="xs:string">
          <xs:length value="4" />
          <xs:pattern value="([0-9])*" />
        </xs:restriction>
      </xs:simpleType>

      <xs:simpleType name="megnevezes_type">
        <xs:restriction base="xs:string">
          <xs:minLength value="1" />
          <xs:pattern value="([a-zA-Z][0-9])*" />
        </xs:restriction>
      </xs:simpleType>

      <xs:simpleType name="nev_type">
        <xs:restriction base="xs:string">
          <xs:pattern value="[A-Z][a-zA-Z]*( [A-Z][a-zA-Z]*)*" />
        </xs:restriction>
      </xs:simpleType>

      <xs:simpleType name="sebesseghatar_type">
        <xs:restriction base="xs:string">
          <xs:maxLength value="3" />
          <xs:pattern value="([0-9])*" />
        </xs:restriction>
      </xs:simpleType>


    <!-- Komplex típusok -->

    <xs:complexType name="autopalya_felugyelet_tipus">
        <xs:sequence>
            <xs:element ref="telepules"/>
        </xs:sequence>
        <xs:attribute ref="AF_ID" use="required"/>
    </xs:complexType>

    <xs:complexType name="alkalmazott_tipus">
        <xs:sequence>
            <xs:element ref="fizetes"/>
            <xs:element ref="ledolgozott_evek"/>
        </xs:sequence>
        <xs:attribute ref="AL_ID" use="required"/>
        <xs:attribute ref="AF_IDREF" use="required"/>
    </xs:complexType>

    <xs:complexType name="autopalya_tipus">
        <xs:sequence>
            <xs:element name="megnevezes" type="megnevezes_type"/>
        </xs:sequence>
        <xs:attribute ref="AU_ID" use="required"/>
        <xs:attribute ref="AF_IDREF" use="required"/>
    </xs:complexType>

    <xs:complexType name="traffipax_tipus">
        <xs:sequence>
            <xs:element ref="sebesseghatar"/>
        </xs:sequence>
        <xs:attribute ref="T_ID" use="required"/>
        <xs:attribute ref="AU_IDREF" use="required"/>
    </xs:complexType>

    <xs:complexType name="buntetes_tipus">
        <xs:sequence>
            <xs:element ref="osszeg"/>
            <xs:element name="datum" type="datum_type"/>
        </xs:sequence>
        <xs:attribute ref="B_ID" use="required"/>
        <xs:attribute ref="AF_IDREF" use="required"/>
    </xs:complexType>

    <xs:complexType name="elerhetoseg_tipus">
        <xs:sequence>
            <xs:element name="nev" type="nev_type"/>
            <xs:element name="iranyitoszam" type="iranyitoszam_type"/>
            <xs:element ref="varos"/>
            <xs:element ref="lakcim"/>
        </xs:sequence>
    </xs:complexType>

    <xs:complexType name="szabalyserto_tipus">
        <xs:sequence>
            <xs:element ref="rendszam"/>
            <xs:element name="elerhetoseg" type="elerhetoseg_tipus"/>
        </xs:sequence>
        <xs:attribute ref="SZ_ID" use="required"/>
        <xs:attribute ref="B_IDREF" use="required"/>
    </xs:complexType>

    <!-- Kiszabott büntetések -->

    <xs:element name="gyorsforgalmi_rendszer">
        <xs:complexType>
            <xs:sequence>
                <xs:element name="autopalya_felugyelet" type="autopalya_felugyelet_tipus" maxOccurs="unbounded"/>
                <xs:element name="alkalmazott" type="alkalmazott_tipus" maxOccurs="unbounded"/>
                <xs:element name="autopalya" type="autopalya_tipus" maxOccurs="unbounded"/>
                <xs:element name="traffipax" type="traffipax_tipus" maxOccurs="unbounded"/>
                <xs:element name="buntetes" type="buntetes_tipus" maxOccurs="unbounded"/>
                <xs:element name="szabalyserto" type="szabalyserto_tipus" maxOccurs="unbounded"/>
            </xs:sequence>
        </xs:complexType>

        <!-- Kulcsok -->

        <xs:unique name="AF_ID">
            <xs:selector xpath="autopalya_felugyelet"/>
            <xs:field xpath="@AF_ID"/>
        </xs:unique>

        <xs:key name="AL_ID">
            <xs:selector xpath="alkalmazott"/>
            <xs:field xpath="@AL_ID"/>
        </xs:key>

        <xs:key name="AU_ID">
            <xs:selector xpath="autopalya"/>
            <xs:field xpath="@AU_ID"/>
        </xs:key>

        <xs:unique name="T_ID">
            <xs:selector xpath="traffipax"/>
            <xs:field xpath="@T_ID"/>
        </xs:unique>

        <xs:key name="B_ID">
            <xs:selector xpath="buntetes"/>
            <xs:field xpath="@B_ID"/>
        </xs:key>

        <xs:key name="SZ_ID">
            <xs:selector xpath="szabalyserto"/>
            <xs:field xpath="@SZ_ID"/>
        </xs:key>

        <!-- Kulcshivatkozások (idegen kulcsok) -->

        <xs:keyref name="autopalya_felugyelet_FK1" refer="AF_ID">
            <xs:selector xpath="alkalmazott"></xs:selector>
            <xs:field xpath="@AF_IDREF"></xs:field>
        </xs:keyref>

        <xs:keyref name="autopalya_felugyelet_FK2" refer="AF_ID">
            <xs:selector xpath="autopalya"></xs:selector>
            <xs:field xpath="@AF_IDREF"></xs:field>
        </xs:keyref>

        <xs:keyref name="autopalya_felugyelet_FK3" refer="AF_ID">
            <xs:selector xpath="buntetes"></xs:selector>
            <xs:field xpath="@AF_IDREF"></xs:field>
        </xs:keyref>

        <xs:keyref name="autopalya_FK1" refer="AU_ID">
            <xs:selector xpath="traffipax"></xs:selector>
            <xs:field xpath="@AU_IDREF"></xs:field>
        </xs:keyref>

        <xs:keyref name="buntetes_FK1" refer="B_ID">
            <xs:selector xpath="szabalyserto"></xs:selector>
            <xs:field xpath="@B_IDREF"></xs:field>
        </xs:keyref>

    </xs:element>

</xs:schema>
